video_time,key,has_unknowns,associated_structures,reference_tag,annotation_type,text_description,ref,url
8:27-8:34,0,FALSE,double membrane vesicles,,structure,Infected cells have numerous DMVs in the perinuclear region.,"Mendonça L, Howe A, Gilchrist JB, Sheng Y, Sun D, Knight ML, Zanetti-Domingues LC, Bateman B, Krebs AS, Chen L, Radecke J, Li VD, Ni T, Kounatidis I, Koronfel MA, Szynkiewicz M, Harkiolaki M, Martin-Fernandez ML, James W, Zhang P. Correlative multi-scale cryo-imaging unveils SARS-CoV-2 assembly and egress. Nat Commun. 2021 Jul 30;12(1):4629. doi: 10.1038/s41467-021-24887-y. PMID: 34330917; PMCID: PMC8324836.",https://www.nature.com/articles/s41467-021-24887-y
8:35-8:51,1,FALSE,nsp3,,structure,"The structure of the pore is based on cryo-electron imaging. The pore has been observed to have a hexameric assembly, and there is typically only one pore per DMV.","Wolff G, Limpens RWAL, Zevenhoven-Dobbe JC, Laugks U, Zheng S, de Jong AWM, Koning RI, Agard DA, Grünewald K, Koster AJ, Snijder EJ, Bárcena M. A molecular pore spans the double membrane of the coronavirus replication organelle. Science. 2020 Sep 11;369(6509):1395-1398. doi: 10.1126/science.abd3629. Epub 2020 Aug 6. PMID: 32763915; PMCID: PMC7665310.",https://www.science.org/doi/10.1126/science.abd3629
8:35-8:51,2,FALSE,"double membrane vesicles,nsp3,membrane, rna",,event,Viral RNA is exported through pores in the DMV membrane that are formed by viral nsps.,"Wolff G, Limpens RWAL, Zevenhoven-Dobbe JC, Laugks U, Zheng S, de Jong AWM, Koning RI, Agard DA, Grünewald K, Koster AJ, Snijder EJ, Bárcena M. A molecular pore spans the double membrane of the coronavirus replication organelle. Science. 2020 Sep 11;369(6509):1395-1398. doi: 10.1126/science.abd3629. Epub 2020 Aug 6. PMID: 32763915; PMCID: PMC7665310.","https://www.science.org/doi/10.1126/science.abd3629
"
8:38-8:55,3,FALSE,"n protein, rna",,event,N proteins bind to and condense viral RNA through a process that is likely mediated through liquid-liquid phase separation.,Perdikari & al. SARS-CoV-2 nucleocapsid protein phase-separates with RNA and with human hnRNPs. EMBO J. 2020 Dec 15;39(24):e106478. doi: 10.15252/embj.2020106478.,
9:02-9:10,4,FALSE,"viral genome,n protein,m protein,e protein,spike protein",,event,"Packaging occurs at the ERGIC compartment, where interactions between M proteins provide the driving force for envelope formation.","Lu S, Ye Q, Singh D, Cao Y, Diedrich JK, Yates JR 3rd, Villa E, Cleveland DW, Corbett KD. The SARS-CoV-2 nucleocapsid phosphoprotein forms mutually exclusive condensates with RNA and the membrane-associated M protein. Nat Commun. 2021 Jan 21;12(1):502. doi: 10.1038/s41467-020-20768-y. ",
9:11-9:22,5,FALSE,virus,,event,"Viruses traffic from the ERGIC to lysosomes and multivesicular bodies, which eventually fuse to the plasma membrane and release viruses.","Ghosh S, Dellibovi-Ragheb TA, Kerviel A, Pak E, Qiu Q, Fisher M, Takvorian PM, Bleck C, Hsu VW, Fehr AR, Perlman S, Achar SR, Straus MR, Whittaker GR, de Haan CAM, Kehrl J, Altan-Bonnet G, Altan-Bonnet N. β-Coronaviruses Use Lysosomes for Egress Instead of the Biosynthetic Secretory Pathway. Cell. 2020 Dec 10;183(6):1520-1535.e14. doi: 10.1016/j.cell.2020.10.039. Epub 2020 Oct 27. PMID: 33157038; PMCID: PMC7590812.",